{
  "title": "Minimal Modular Example",
  "style": "minimal-modular",
  "canvas": {"width": 1600, "height": 800},
  "font": "Times New Roman",
  "groups": [],
  "nodes": [
    {"id": "input", "kind": "input", "label": "Input sequence", "x": 90, "y": 330, "width": 210, "height": 110},
    {"id": "encoder", "kind": "shared-module", "label": "Shared Encoder (θ)", "x": 390, "y": 300, "width": 240, "height": 170, "ports": [{"id": "in", "x": 0, "y": 0.5}, {"id": "out", "x": 1, "y": 0.5}]},
    {"id": "latent", "kind": "tensor", "label": "Latent tokens", "x": 735, "y": 320, "width": 180, "height": 130},
    {"id": "reasoner", "kind": "module", "label": "Context Reasoner", "x": 1015, "y": 315, "width": 220, "height": 140},
    {"id": "output", "kind": "output", "label": "Prediction", "x": 1335, "y": 330, "width": 180, "height": 110}
  ],
  "edges": [
    {"id": "e1", "source": "input", "target": "encoder", "targetPort": "in"},
    {"id": "e2", "source": "encoder", "sourcePort": "out", "target": "latent"},
    {"id": "e3", "source": "latent", "target": "reasoner"},
    {"id": "e4", "source": "reasoner", "target": "output"}
  ],
  "constraints": {"singletons": [{"label": "Shared Encoder (θ)", "count": 1}], "forbiddenLabels": []},
  "outputs": ["drawio", "png", "pdf"]
}
